{
  "generated_at": "2026-06-17T06:58:45.066Z",
  "last_successful_generated_at": "2026-06-17T06:58:45.066Z",
  "refresh_status": "ok",
  "classification_mode": "deterministic",
  "window_hours": 168,
  "source_total": 1,
  "source_ok": 1,
  "source_failed": 0,
  "failed_sources": [],
  "source_health": [
    {
      "id": "github_trending_daily",
      "name": "GitHub Trending",
      "status": "ok",
      "fetched_count": 1,
      "fresh_count": 1,
      "stale_count": 0,
      "oldest_published_at": "2026-06-17T06:58:45.066Z",
      "newest_published_at": "2026-06-17T06:58:45.066Z"
    }
  ],
  "count": 1,
  "clusters": [
    {
      "id": "11jx6ou",
      "primary": {
        "id": "11jx6ou",
        "source_id": "github_trending_daily",
        "source_name": "GitHub Trending",
        "source_role": "repo",
        "trust": 0.66,
        "kind_hint": "repo_trending",
        "title": "alibaba/zvec (+156 stars today)",
        "url": "https://github.com/alibaba/zvec",
        "original_url": "https://github.com/alibaba/zvec",
        "summary": "A lightweight, lightning-fast, in-process vector database · C++ · Apache-2.0 · +156 stars today · agent-skills · db · embedded · faiss · hnsw · llm-memory · local · rag · search-engine · semantic-search · similarity-search · vector-database · vector-db",
        "image_url": "https://zvec.oss-cn-hongkong.aliyuncs.com/logo/github_logo_1.svg",
        "image_source": "github_readme",
        "published_at": "2026-06-17T06:58:45.066Z",
        "published_at_source": "generated_fallback",
        "date_confidence": "low",
        "engagement": {
          "score": 156
        },
        "repo": {
          "full_name": "alibaba/zvec",
          "html_url": "https://github.com/alibaba/zvec",
          "description": "A lightweight, lightning-fast, in-process vector database",
          "language": "C++",
          "license": "Apache-2.0",
          "topics": [
            "agent-skills",
            "db",
            "embedded",
            "faiss",
            "hnsw",
            "llm-memory",
            "local",
            "rag",
            "search-engine",
            "semantic-search",
            "similarity-search",
            "vector-database",
            "vector-db"
          ],
          "stargazers_count": 10634,
          "forks_count": 615,
          "open_issues_count": 56,
          "pushed_at": "2026-06-17T06:18:12Z",
          "created_at": "2025-12-05T07:45:38Z",
          "stars_today": 156,
          "stars_delta_run": 248,
          "stars_delta_30d": 248,
          "trending_period": "daily",
          "readme_image_url": "https://zvec.oss-cn-hongkong.aliyuncs.com/logo/github_logo_1.svg"
        }
      },
      "members": [
        {
          "id": "11jx6ou",
          "source_id": "github_trending_daily",
          "source_name": "GitHub Trending",
          "source_role": "repo",
          "trust": 0.66,
          "kind_hint": "repo_trending",
          "title": "alibaba/zvec (+156 stars today)",
          "url": "https://github.com/alibaba/zvec",
          "original_url": "https://github.com/alibaba/zvec",
          "summary": "A lightweight, lightning-fast, in-process vector database · C++ · Apache-2.0 · +156 stars today · agent-skills · db · embedded · faiss · hnsw · llm-memory · local · rag · search-engine · semantic-search · similarity-search · vector-database · vector-db",
          "image_url": "https://zvec.oss-cn-hongkong.aliyuncs.com/logo/github_logo_1.svg",
          "image_source": "github_readme",
          "published_at": "2026-06-17T06:58:45.066Z",
          "published_at_source": "generated_fallback",
          "date_confidence": "low",
          "engagement": {
            "score": 156
          },
          "repo": {
            "full_name": "alibaba/zvec",
            "html_url": "https://github.com/alibaba/zvec",
            "description": "A lightweight, lightning-fast, in-process vector database",
            "language": "C++",
            "license": "Apache-2.0",
            "topics": [
              "agent-skills",
              "db",
              "embedded",
              "faiss",
              "hnsw",
              "llm-memory",
              "local",
              "rag",
              "search-engine",
              "semantic-search",
              "similarity-search",
              "vector-database",
              "vector-db"
            ],
            "stargazers_count": 10634,
            "forks_count": 615,
            "open_issues_count": 56,
            "pushed_at": "2026-06-17T06:18:12Z",
            "created_at": "2025-12-05T07:45:38Z",
            "stars_today": 156,
            "stars_delta_run": 248,
            "stars_delta_30d": 248,
            "trending_period": "daily",
            "readme_image_url": "https://zvec.oss-cn-hongkong.aliyuncs.com/logo/github_logo_1.svg"
          }
        }
      ],
      "source_trail": [
        {
          "source_id": "github_trending_daily",
          "source_name": "GitHub Trending",
          "title": "alibaba/zvec (+156 stars today)",
          "url": "https://github.com/alibaba/zvec",
          "published_at": "2026-06-17T06:58:45.066Z",
          "published_at_source": "generated_fallback",
          "date_confidence": "low"
        }
      ],
      "also_seen_on": [],
      "kind": "repo_trending",
      "quality": "signal",
      "one_liner": "A lightweight, lightning-fast, in-process vector database · C++ · Apache-2.0 · +156 stars today · agent-skills · db · embedded · faiss · hnsw · llm-memory · local · rag · search-engine · semantic-sear",
      "novelty": 0.235,
      "novelty_label": "familiar",
      "trust": 0.66,
      "score": 0.663,
      "why_this_surfaced": [
        "kept for context despite familiar coverage",
        "classified as concrete builder or research signal",
        "high daily GitHub star velocity",
        "fresh within the current refresh window"
      ],
      "builder_action": "Inspect docs, issue activity, and recent commits before depending on it."
    }
  ]
}
