{
  "generated_at": "2026-06-14T12:57:54.916Z",
  "last_successful_generated_at": "2026-06-14T12:57:54.916Z",
  "refresh_status": "ok",
  "classification_mode": "deterministic",
  "window_hours": 168,
  "source_total": 1,
  "source_ok": 1,
  "source_failed": 0,
  "failed_sources": [],
  "source_health": [
    {
      "id": "github_trending_daily",
      "name": "GitHub Trending",
      "status": "ok",
      "fetched_count": 2,
      "fresh_count": 2,
      "stale_count": 0,
      "oldest_published_at": "2026-06-14T12:57:54.916Z",
      "newest_published_at": "2026-06-14T12:57:54.916Z"
    }
  ],
  "count": 2,
  "clusters": [
    {
      "id": "1o8ny3i",
      "primary": {
        "id": "1o8ny3i",
        "source_id": "github_trending_daily",
        "source_name": "GitHub Trending",
        "source_role": "repo",
        "trust": 0.66,
        "kind_hint": "repo_trending",
        "title": "NVIDIA/SkillSpector (+962 stars today)",
        "url": "https://github.com/NVIDIA/SkillSpector",
        "original_url": "https://github.com/NVIDIA/SkillSpector",
        "summary": "Security scanner for AI agent skills. Detect vulnerabilities, malicious patterns, and security risks. · Python · Apache-2.0 · +962 stars today",
        "published_at": "2026-06-14T12:57:54.916Z",
        "published_at_source": "generated_fallback",
        "date_confidence": "low",
        "engagement": {
          "score": 962
        },
        "repo": {
          "full_name": "NVIDIA/SkillSpector",
          "html_url": "https://github.com/NVIDIA/SkillSpector",
          "description": "Security scanner for AI agent skills. Detect vulnerabilities, malicious patterns, and security risks.",
          "language": "Python",
          "license": "Apache-2.0",
          "topics": [],
          "stargazers_count": 4877,
          "forks_count": 372,
          "open_issues_count": 37,
          "pushed_at": "2026-06-13T18:34:29Z",
          "created_at": "2026-03-21T00:28:43Z",
          "stars_today": 962,
          "stars_delta_run": 235,
          "stars_delta_30d": 235,
          "trending_period": "daily"
        }
      },
      "members": [
        {
          "id": "1o8ny3i",
          "source_id": "github_trending_daily",
          "source_name": "GitHub Trending",
          "source_role": "repo",
          "trust": 0.66,
          "kind_hint": "repo_trending",
          "title": "NVIDIA/SkillSpector (+962 stars today)",
          "url": "https://github.com/NVIDIA/SkillSpector",
          "original_url": "https://github.com/NVIDIA/SkillSpector",
          "summary": "Security scanner for AI agent skills. Detect vulnerabilities, malicious patterns, and security risks. · Python · Apache-2.0 · +962 stars today",
          "published_at": "2026-06-14T12:57:54.916Z",
          "published_at_source": "generated_fallback",
          "date_confidence": "low",
          "engagement": {
            "score": 962
          },
          "repo": {
            "full_name": "NVIDIA/SkillSpector",
            "html_url": "https://github.com/NVIDIA/SkillSpector",
            "description": "Security scanner for AI agent skills. Detect vulnerabilities, malicious patterns, and security risks.",
            "language": "Python",
            "license": "Apache-2.0",
            "topics": [],
            "stargazers_count": 4877,
            "forks_count": 372,
            "open_issues_count": 37,
            "pushed_at": "2026-06-13T18:34:29Z",
            "created_at": "2026-03-21T00:28:43Z",
            "stars_today": 962,
            "stars_delta_run": 235,
            "stars_delta_30d": 235,
            "trending_period": "daily"
          }
        }
      ],
      "source_trail": [
        {
          "source_id": "github_trending_daily",
          "source_name": "GitHub Trending",
          "title": "NVIDIA/SkillSpector (+962 stars today)",
          "url": "https://github.com/NVIDIA/SkillSpector",
          "published_at": "2026-06-14T12:57:54.916Z",
          "published_at_source": "generated_fallback",
          "date_confidence": "low"
        }
      ],
      "also_seen_on": [],
      "kind": "repo_trending",
      "quality": "signal",
      "one_liner": "Security scanner for AI agent skills. Detect vulnerabilities, malicious patterns, and security risks. · Python · Apache-2.0 · +962 stars today",
      "novelty": 1,
      "novelty_label": "high",
      "trust": 0.66,
      "score": 0.934,
      "why_this_surfaced": [
        "high novelty against the 30-day history",
        "classified as concrete builder or research signal",
        "high daily GitHub star velocity",
        "fresh within the current refresh window"
      ],
      "builder_action": "Inspect docs, issue activity, and recent commits before depending on it."
    },
    {
      "id": "bpz8xj",
      "primary": {
        "id": "bpz8xj",
        "source_id": "github_trending_daily",
        "source_name": "GitHub Trending",
        "source_role": "repo",
        "trust": 0.66,
        "kind_hint": "repo_trending",
        "title": "andrewyng/aisuite (+290 stars today)",
        "url": "https://github.com/andrewyng/aisuite",
        "original_url": "https://github.com/andrewyng/aisuite",
        "summary": "Simple, unified interface to multiple Generative AI providers · Python · MIT · +290 stars today",
        "published_at": "2026-06-14T12:57:54.916Z",
        "published_at_source": "generated_fallback",
        "date_confidence": "low",
        "engagement": {
          "score": 290
        },
        "repo": {
          "full_name": "andrewyng/aisuite",
          "html_url": "https://github.com/andrewyng/aisuite",
          "description": "Simple, unified interface to multiple Generative AI providers ",
          "language": "Python",
          "license": "MIT",
          "topics": [],
          "stargazers_count": 14270,
          "forks_count": 1493,
          "open_issues_count": 133,
          "pushed_at": "2026-06-14T05:57:09Z",
          "created_at": "2024-06-30T20:07:46Z",
          "stars_today": 290,
          "stars_delta_run": 76,
          "stars_delta_30d": 76,
          "trending_period": "daily"
        }
      },
      "members": [
        {
          "id": "bpz8xj",
          "source_id": "github_trending_daily",
          "source_name": "GitHub Trending",
          "source_role": "repo",
          "trust": 0.66,
          "kind_hint": "repo_trending",
          "title": "andrewyng/aisuite (+290 stars today)",
          "url": "https://github.com/andrewyng/aisuite",
          "original_url": "https://github.com/andrewyng/aisuite",
          "summary": "Simple, unified interface to multiple Generative AI providers · Python · MIT · +290 stars today",
          "published_at": "2026-06-14T12:57:54.916Z",
          "published_at_source": "generated_fallback",
          "date_confidence": "low",
          "engagement": {
            "score": 290
          },
          "repo": {
            "full_name": "andrewyng/aisuite",
            "html_url": "https://github.com/andrewyng/aisuite",
            "description": "Simple, unified interface to multiple Generative AI providers ",
            "language": "Python",
            "license": "MIT",
            "topics": [],
            "stargazers_count": 14270,
            "forks_count": 1493,
            "open_issues_count": 133,
            "pushed_at": "2026-06-14T05:57:09Z",
            "created_at": "2024-06-30T20:07:46Z",
            "stars_today": 290,
            "stars_delta_run": 76,
            "stars_delta_30d": 76,
            "trending_period": "daily"
          }
        }
      ],
      "source_trail": [
        {
          "source_id": "github_trending_daily",
          "source_name": "GitHub Trending",
          "title": "andrewyng/aisuite (+290 stars today)",
          "url": "https://github.com/andrewyng/aisuite",
          "published_at": "2026-06-14T12:57:54.916Z",
          "published_at_source": "generated_fallback",
          "date_confidence": "low"
        }
      ],
      "also_seen_on": [],
      "kind": "repo_trending",
      "quality": "signal",
      "one_liner": "Simple, unified interface to multiple Generative AI providers · Python · MIT · +290 stars today",
      "novelty": 1,
      "novelty_label": "high",
      "trust": 0.66,
      "score": 0.907,
      "why_this_surfaced": [
        "high novelty against the 30-day history",
        "classified as concrete builder or research signal",
        "high daily GitHub star velocity",
        "fresh within the current refresh window"
      ],
      "builder_action": "Inspect docs, issue activity, and recent commits before depending on it."
    }
  ]
}
